{"observed_derived":{"difference_vs_ar6_2011_2020":0.033,"gistemp_comparison_not_available":"GISTEMP starts in 1880, so a 1850-1900 baseline would silently be 1880-1900 (a different, warmer-biased reference). It is deliberately not offered.","hadcrut5_rebased_1850_1900":{"latest_year":2025.0,"latest_year_value":1.433,"mean_2001_2020":1.021,"mean_2005_2024":1.113,"mean_2011_2020":1.123,"mean_2015_2024":1.269},"note":"HadCRUT5 annual means rebased to 1850-1900 (monthly rebasing), averaged over the same periods AR6 uses. AR6's own value is an assessment from several datasets, so a small difference is expected.","within_ar6_assessed_range_2011_2020":true},"observed_published":[{"assessed_high_c":1.1,"assessed_low_c":0.84,"baseline":"1850-1900","best_estimate_c":0.99,"page_pdf":9,"period":"2001-2020","quantity":"global_surface_temperature_change"},{"assessed_high_c":1.2,"assessed_low_c":0.95,"baseline":"1850-1900","best_estimate_c":1.09,"page_pdf":9,"period":"2011-2020","quantity":"global_surface_temperature_change"},{"assessed_high_c":1.83,"assessed_low_c":1.34,"baseline":"1850-1900","best_estimate_c":1.59,"page_pdf":9,"period":"2011-2020","quantity":"land_surface_temperature_change"},{"assessed_high_c":1.01,"assessed_low_c":0.68,"baseline":"1850-1900","best_estimate_c":0.88,"page_pdf":9,"period":"2011-2020","quantity":"ocean_surface_temperature_change"}],"scenarios":[{"ghg_description":"Very low GHG emissions","id":"SSP1-1.9","label":"SSP1-1.9","rows":[{"best_estimate_c":1.5,"period":"2021-2040","very_likely_high_c":1.7,"very_likely_low_c":1.2},{"best_estimate_c":1.6,"period":"2041-2060","very_likely_high_c":2.0,"very_likely_low_c":1.2},{"best_estimate_c":1.4,"period":"2081-2100","very_likely_high_c":1.8,"very_likely_low_c":1.0}]},{"ghg_description":"Low GHG emissions","id":"SSP1-2.6","label":"SSP1-2.6","rows":[{"best_estimate_c":1.5,"period":"2021-2040","very_likely_high_c":1.8,"very_likely_low_c":1.2},{"best_estimate_c":1.7,"period":"2041-2060","very_likely_high_c":2.2,"very_likely_low_c":1.3},{"best_estimate_c":1.8,"period":"2081-2100","very_likely_high_c":2.4,"very_likely_low_c":1.3}]},{"ghg_description":"Intermediate GHG emissions","id":"SSP2-4.5","label":"SSP2-4.5","rows":[{"best_estimate_c":1.5,"period":"2021-2040","very_likely_high_c":1.8,"very_likely_low_c":1.2},{"best_estimate_c":2.0,"period":"2041-2060","very_likely_high_c":2.5,"very_likely_low_c":1.6},{"best_estimate_c":2.7,"period":"2081-2100","very_likely_high_c":3.5,"very_likely_low_c":2.1}]},{"ghg_description":"High GHG emissions","id":"SSP3-7.0","label":"SSP3-7.0","rows":[{"best_estimate_c":1.5,"period":"2021-2040","very_likely_high_c":1.8,"very_likely_low_c":1.2},{"best_estimate_c":2.1,"period":"2041-2060","very_likely_high_c":2.6,"very_likely_low_c":1.7},{"best_estimate_c":3.6,"period":"2081-2100","very_likely_high_c":4.6,"very_likely_low_c":2.8}]},{"ghg_description":"Very high GHG emissions","id":"SSP5-8.5","label":"SSP5-8.5","rows":[{"best_estimate_c":1.6,"period":"2021-2040","very_likely_high_c":1.9,"very_likely_low_c":1.3},{"best_estimate_c":2.4,"period":"2041-2060","very_likely_high_c":3.0,"very_likely_low_c":1.9},{"best_estimate_c":4.4,"period":"2081-2100","very_likely_high_c":5.7,"very_likely_low_c":3.3}]}],"schema_version":"v1","source":{"averaging":"running 20-year averages unless stated otherwise; very likely range = 90-100% probability","baseline":"1850-1900","license_note":"The AR6 licence page returned HTTP 403 and could not be verified. Only short factual values are quoted, each with a page citation; nothing is recomputed or extrapolated.","name":"IPCC AR6 WGI Summary for Policymakers","page_pdf":18,"page_printed":14,"table":"Table SPM.1 (changes in global surface temperature, relative to 1850-1900)","url":"https://www.ipcc.ch/report/ar6/wg1/downloads/report/IPCC_AR6_WGI_SPM_final.pdf"},"tags":{"observed_derived":"DERIVED","observed_published":"OBSERVED","scenarios":"PREDICTED","source":"PREDICTED","tags_note":"DERIVED"},"tags_note":"scenarios and observed_published are IPCC assessed values (PREDICTED/assessed by IPCC, not by this project); observed_derived is our HadCRUT5 arithmetic (DERIVED)."}
